{
  "id": "set01",
  "language": "en",
  "title": "Sample English Set",
  "questions": [
    {
      "id": 0,
      "question": "Which number completes the series: 3, 6, 12, 24, ?",
      "options": ["30", "36", "40", "48"],
      "answer": 3,
      "explanation": "Multiply by 2 each time",
      "irt": {"a": 1.0, "b": 0.0}
    },
    {
      "id": 1,
      "question": "If some Fribs are Zogs and all Zogs are Pibs, can we say all Fribs are definitely Pibs?",
      "options": ["Yes", "No", "Only some", "Can't tell"],
      "answer": 0,
      "explanation": "All Fribs that are Zogs are Pibs",
      "irt": {"a": 1.0, "b": 0.0}
    }
  ]
}
