{
  "id": "set02",
  "language": "ja",
  "title": "日本語版サンプルセット",
  "questions": [
    {
      "id": 0,
      "question": "次の数列を完成させてください: 2, 4, 8, 16, ?",
      "options": ["18", "24", "32", "48"],
      "answer": 2,
      "category": "numerical",
      "difficulty": "easy",
      "needs_image": false,
      "irt": {"a": 1.0, "b": -0.5}
    }
  ]
}
